{"schema_version":"1","host":{"os_id":"arch","kernel":null,"architecture":"x86_64","environment":"omarchy","evidence_sources":[]},"platform":{"supported_baseline":"v4.0.6","compatibility":"available","raw_package_identity":null,"upstream_version":null,"development_override":false},"checks":[{"id":"platform.omarchy","required_for":["desktop"],"status":"deferred","observed":null,"expected":null,"evidence":[],"reason":"fixture only","remedy":"none"}],"capabilities":{"core":{"ready":true,"required_checks":[]},"blender":{"ready":false,"required_checks":[]},"ifc":{"ready":false,"required_checks":[]},"containment":{"ready":false,"required_checks":[]},"desktop":{"ready":false,"required_checks":[]}},"ready":true,"target_acceptance":"deferred","target_gates":[{"id":"OM-A21-01","status":"deferred","reason":"fixture only"}]}
